{
  "id": "AR_20001003_5WTEHK",
  "name": "Rantaro",
  "surname": "Amami",
  "heightM": 1.78,
  "heightCM": 0,
  "weight": 62,
  "chest": 81,
  "blood": "B",
  "dob": "2000-10-03",
  "likes": "Extraterrestrial rights",
  "dislikes": "Cats",
  "notes": "Ultimate ???",
  "isHeadmaster": false,
  "position": 11,
  "lastModified": "2025-12-31T13:38:14.577Z"
}