{
  "id": "ST_20000815_PRAAUI",
  "name": "Tsumugi",
  "surname": "Shirogane",
  "heightM": 1.75,
  "heightCM": 0,
  "weight": 51,
  "chest": 89,
  "blood": "A",
  "dob": "2000-08-15",
  "likes": "EVA foam",
  "dislikes": "Disorderly queues",
  "notes": "Ultimate Cosplayer",
  "isHeadmaster": false,
  "position": 5,
  "lastModified": "2025-12-31T13:38:14.255Z"
}