{
  "id": "IM_20001116_7Y8JMH",
  "name": "Miu",
  "surname": "Iruma",
  "heightM": 1.73,
  "heightCM": 0,
  "weight": 56,
  "chest": 89,
  "blood": "AB",
  "dob": "2000-11-16",
  "likes": "Children's television",
  "dislikes": "Taking it easy",
  "notes": "Ultimate Inventor",
  "isHeadmaster": false,
  "position": 7,
  "lastModified": "2025-12-31T13:38:14.357Z"
}