{
  "id": "SK_20000731_XCHFGA",
  "name": "Korekiyo",
  "surname": "Shinguji",
  "heightM": 1.88,
  "heightCM": 0,
  "weight": 65,
  "chest": 81,
  "blood": "AB",
  "dob": "2000-07-31",
  "likes": "Snow globes",
  "dislikes": "Air conditioning",
  "notes": "Ultimate Anthropologist",
  "isHeadmaster": false,
  "position": 14,
  "lastModified": "2025-12-31T13:38:14.741Z"
}