{
  "id": "CT_20000109_WOFW5K",
  "name": "Tenko",
  "surname": "Chabashira",
  "heightM": 1.65,
  "heightCM": 0,
  "weight": 52,
  "chest": 89,
  "blood": "B",
  "dob": "2000-01-09",
  "likes": "Nunchucks",
  "dislikes": "Men",
  "notes": "Ultimate Aikido Master",
  "isHeadmaster": false,
  "position": 4,
  "lastModified": "2025-12-31T13:38:14.200Z"
}