{
  "id": "HM_20000202_C4WPU8",
  "name": "Maki",
  "surname": "Harukawa",
  "heightM": 1.63,
  "heightCM": 0,
  "weight": 44,
  "chest": 76,
  "blood": "B",
  "dob": "2000-02-02",
  "likes": "Morning lake shores",
  "dislikes": "Winter lake shores",
  "notes": "Ultimate Caregiver",
  "isHeadmaster": false,
  "position": 3,
  "lastModified": "2025-12-31T13:38:14.147Z"
}