{
  "id": "OK_20000621_ZTQDRF",
  "name": "Kokichi",
  "surname": "Oma",
  "heightM": 1.55,
  "heightCM": 0,
  "weight": 44,
  "chest": 71,
  "blood": "A",
  "dob": "2000-06-21",
  "likes": "Carbonated drinks",
  "dislikes": "Big feet",
  "notes": "Ultimate Supreme Leader",
  "isHeadmaster": false,
  "position": 13,
  "lastModified": "2025-12-31T13:38:14.688Z"
}