{
  "id": "AK_20000326_EJBPMB",
  "name": "Kaede",
  "surname": "Akamatsu",
  "heightM": 1.73,
  "heightCM": 0,
  "weight": 53,
  "chest": 89,
  "blood": "O",
  "dob": "2000-03-26",
  "likes": "Piano keys",
  "dislikes": "Bicycles",
  "notes": "Ultimate Pianist",
  "isHeadmaster": false,
  "position": 0,
  "lastModified": "2025-12-31T13:38:14.000Z"
}