{
  "id": "YA_20000418_KHE816",
  "name": "Angie",
  "surname": "Yonaga",
  "heightM": 1.55,
  "heightCM": 0,
  "weight": 41,
  "chest": 81,
  "blood": "B",
  "dob": "2000-04-18",
  "likes": "Avocados",
  "dislikes": "Humidity",
  "notes": "Ultimate Artist",
  "isHeadmaster": false,
  "position": 6,
  "lastModified": "2025-12-31T13:38:14.305Z"
}