{
  "id": "MK_20000412_JPIYF0",
  "name": "Kaito",
  "surname": "Momota",
  "heightM": 1.83,
  "heightCM": 0,
  "weight": 74,
  "chest": 89,
  "blood": "B",
  "dob": "2000-04-12",
  "likes": "House plants",
  "dislikes": "Ghosts",
  "notes": "Ultimate Astronaut",
  "isHeadmaster": false,
  "position": 9,
  "lastModified": "2025-12-31T13:38:14.475Z"
}