{
  "id": "GG_20000123_ACP7QY",
  "name": "Gonta",
  "surname": "Gokuhara",
  "heightM": 1.98,
  "heightCM": 0,
  "weight": 94,
  "chest": 109,
  "blood": "A",
  "dob": "2000-01-23",
  "likes": "Arthropods",
  "dislikes": "Murder",
  "notes": "Ultimate Entomologist",
  "isHeadmaster": false,
  "position": 12,
  "lastModified": "2025-12-31T13:38:14.637Z"
}