{
  "id": "KK_20001029_MXEP9E",
  "name": "K1-B0",
  "surname": "Kiibo",
  "heightM": 1.6,
  "heightCM": 0,
  "weight": 89,
  "chest": 89,
  "blood": "Unknown",
  "dob": "2000-10-29",
  "likes": "100-240 volts",
  "dislikes": "Killing games",
  "notes": "Ultimate Robot",
  "isHeadmaster": false,
  "position": 15,
  "lastModified": "2025-12-31T13:38:14.790Z"
}